{
  "name": "John Doe",
  "position": "Senior Software Engineer",
  "bio": "Passionate about developer productivity and AI-assisted development. 10+ years of experience in software engineering and DevOps.",
  "email": "john.doe@example.com",
  "github": "johndoe",
  "company": "Xebia",
  "image": "john-doe.svg"
}
